<!ELEMENT neuropsych_waiting_list_card_grade (id,created_at,updated_at,deleted_at,neuropsych_waiting_list_card_id,waiting_time_status,clinical_priority,target_wait_weeks,days_waited,weeks_waited,days_to_target,days_to_breach,days_to_appointment,grader_notes,graded_at)>
<!ELEMENT id (#PCDATA)>
<!ELEMENT created_at (#PCDATA)>
<!ELEMENT updated_at (#PCDATA)>
<!ELEMENT deleted_at (#PCDATA)>
<!ELEMENT neuropsych_waiting_list_card_id (#PCDATA)>
<!ELEMENT waiting_time_status (#PCDATA)>
<!ELEMENT clinical_priority (#PCDATA)>
<!ELEMENT target_wait_weeks (#PCDATA)>
<!ELEMENT days_waited (#PCDATA)>
<!ELEMENT weeks_waited (#PCDATA)>
<!ELEMENT days_to_target (#PCDATA)>
<!ELEMENT days_to_breach (#PCDATA)>
<!ELEMENT days_to_appointment (#PCDATA)>
<!ELEMENT grader_notes (#PCDATA)>
<!ELEMENT graded_at (#PCDATA)>
