<?xml version="1.0" encoding="UTF-8"?>
<!DOCTYPE neuropsych_waiting_list_card_grade SYSTEM "neuropsych_waiting_list_card_grade.dtd">
<neuropsych_waiting_list_card_grade>
<id>990e8400-e29b-41d4-a716-446655440004</id>
<created_at>2026-04-09T10:00:00Z</created_at>
<updated_at>2026-04-09T10:00:00Z</updated_at>
<deleted_at>2026-04-09T10:00:00Z</deleted_at>
<neuropsych_waiting_list_card_id>770e8400-e29b-41d4-a716-446655440002</neuropsych_waiting_list_card_id>
<waiting_time_status>within-target</waiting_time_status>
<clinical_priority>P1a</clinical_priority>
<target_wait_weeks>0.0</target_wait_weeks>
<days_waited>1</days_waited>
<weeks_waited>0.0</weeks_waited>
<days_to_target>1</days_to_target>
<days_to_breach>1</days_to_breach>
<days_to_appointment>1</days_to_appointment>
<grader_notes>Example text.</grader_notes>
<graded_at>2026-04-09T10:00:00Z</graded_at>
</neuropsych_waiting_list_card_grade>
